{
  "reasoning": "To achieve a 'psytrance that really makes you dance', I will focus on a high-energy, driving 'Full-On' Psytrance style. I will use a high Weirdness (0.6) to encourage trippy, unexpected textures, but a high Style Influence (0.7) to ensure it stays strictly within the genre. The lyrics will use specific V5 structural tags like [Drop] and [Arpeggiator] to control the energy flow. I will exclude 'vocals' and 'pop' to keep it underground and hypnotic, though a few robotic spoken words are acceptable in the genre.",
  "style_prompt": [
    "Psytrance",
    "Full-On",
    "Goa Trance",
    "Driving Bassline",
    "Acid 303",
    "Hypnotic"
  ],
  "exclude_styles": "Pop, Rock, Trap, acoustic guitar, singing, melody, vocals",
  "lyrics": "[Intro | Atmospheric | Alien Texture]\n(Initiating neural link...)\n\n[Build Up | Snare Roll | Rising Filter]\n\n[Drop | Heavy Bass | 145 BPM]\n\n[Verse | Minimal | Acid Squelch]\n(Focus...)\n\n[Break | Ethereal Pad | Arpeggiator]\n\n[Build Up | Intense]\n\n[Drop | Maximum Power | ðŸ’£ðŸ”¥]\n\n[Outro | Fading Echoes]",
  "parameters": {
    "weirdness": 0.6,
    "style_influence": 0.7
  }
}
